{
  "schema_version": "1.0",
  "command_id": "cmd-001",
  "status": "OUTCOME_UNKNOWN",
  "updated_at": "2026-10-20T12:00:11Z",
  "delivered_at": "2026-10-20T12:00:01Z",
  "reason_code": "RESULT_WAIT_EXCEEDED",
  "reason": "Query the original command ID and reconcile equipment feedback; do not execute a new ID automatically."
}
